Symbol,Name,Last Sale,Net Change,% Change,Market Cap,Country,IPO Year,Volume,Sector,Industry
CVA,Covanta Holding Corporation Common Stock,$14.90,-0.15,-0.997%,1981295137.00,United States,,719508,,
CVE,Cenovus Energy Inc Common Stock,$9.42,0.24,2.614%,19004488046.00,Canada,,9810529,,
CVEO,Civeo Corporation (Canada) Common Shares,$17.74,0.13,0.738%,253555443.00,,2014,31883,,
CVI,CVR Energy Inc. Common Stock,$23.02,0.50,2.22%,2314214389.00,United States,2007,531688,Energy,Integrated oil Companies
CVII,Churchill Capital Corp VII Class A Common Stock,$9.79,-0.01,-0.102%,1688775000.00,,2021,115027,,
CVNA,Carvana Co. Class A Common Stock,$279.87,5.97,2.18%,48244850920.00,United States,2017,776662,Consumer Services,Other Specialty Stores
CVS,CVS Health Corporation Common Stock,$86.47,-0.59,-0.678%,113843623805.00,United States,,4606676,Health Care,Managed Health Care
CVX,Chevron Corporation Common Stock,$108.45,0.86,0.799%,209098017963.00,United States,,6698126,Energy,Integrated oil Companies
CW,Curtiss-Wright Corporation Common Stock,$125.69,1.02,0.818%,5145526506.00,United States,,163566,Capital Goods,Industrial Machinery/Components
CWEN,Clearway Energy Inc. Class C Common Stock,$26.50,0.03,0.113%,5348672762.00,United States,2015,465476,Public Utilities,Electric Utilities: Central
CWH,Camping World Holdings Inc. Class A Commom Stock,$41.05,0.00,0.00%,3635833105.00,United States,2016,977302,Capital Goods,Recreational Products/Toys
CWK,Cushman & Wakefield plc Ordinary Shares,$18.10,-0.05,-0.275%,4034669769.00,,2018,1423207,Finance,Real Estate
CWT,California Water Service Group Common Stock,$56.66,-0.28,-0.492%,2880311100.00,United States,,106016,Public Utilities,Water Supply
CX,Cemex S.A.B. de C.V. Sponsored ADR,$8.23,0.03,0.366%,12121942903.00,Mexico,,5284820,Capital Goods,Building Materials
CXE,MFS High Income Municipal Trust Common Stock,$5.40,0.00,0.00%,170216365.00,United States,1989,38956,,
CXH,MFS Investment Grade Municipal Trust Common Stock,$10.07,-0.035,-0.346%,91740167.00,United States,1989,7418,,
CXP,Columbia Property Trust Inc. Common Stock,$18.28,-0.09,-0.49%,2099807605.00,United States,2013,520880,Consumer Services,Real Estate Investment Trusts
CXW,CoreCivic Inc. Common Stock,$9.03,-0.04,-0.441%,1086100551.00,United States,,1510886,Consumer Services,Real Estate Investment Trusts
CYD,China Yuchai International Limited Common Stock,$15.75,0.10,0.639%,643518068.00,Singapore,1994,7672,Capital Goods,Construction/Ag Equipment/Trucks
CYH,Community Health Systems Inc. Common Stock,$16.10,0.12,0.751%,2127446658.00,United States,2000,1373966,Health Care,Hospital/Nursing Management
D,Dominion Energy Inc. Common Stock,$76.52,-0.19,-0.248%,61715242267.00,United States,,3357106,Public Utilities,Electric Utilities: Central
DAC,Danaos Corporation Common Stock,$62.38,-0.12,-0.192%,1284986018.00,Greece,2006,371723,Transportation,Marine Transportation
DAL,Delta Air Lines Inc. Common Stock,$45.98,-0.15,-0.325%,29410963221.00,United States,,7694420,Transportation,Air Freight/Delivery Services
DAN,Dana Incorporated Common Stock ,$27.90,-0.11,-0.393%,4049499772.00,United States,,763255,Capital Goods,Auto Parts:O.E.M.
DAO,Youdao Inc. American Depositary Shares each representing one Class A Ordinary Share,$23.03,0.07,0.305%,2855281417.00,,2019,307156,Consumer Services,Other Consumer Services
DAR,Darling Ingredients Inc. Common Stock,$71.96,1.15,1.624%,11741870145.00,United States,,1237796,Consumer Non-Durables,Farming/Seeds/Milling
DASH,DoorDash Inc. Class A Common Stock,$143.80,4.69,3.371%,46855483405.00,,2020,2384048,Capital Goods,Industrial Machinery/Components
DAVA,Endava plc American Depositary Shares (each representing one Class A Ordinary Share),$103.80,0.45,0.435%,5721180411.00,,2018,116853,Technology,EDP Services
DB,Deutsche Bank AG Common Stock,$15.12,-0.07,-0.461%,31249609741.00,Germany,,2480880,Finance,Commercial Banks
DBD,Diebold Nixdorf Incorporated Common Stock,$14.40,0.34,2.418%,1126486901.00,United States,,619108,Technology,EDP Services
DBI,Designer Brands Inc. Class A Common Stock,$16.08,-0.74,-4.40%,1171719386.00,United States,,2674680,Consumer Services,Clothing/Shoe/Accessory Stores
DBL,DoubleLine Opportunistic Credit Fund Common Shares of Beneficial Interest,$19.80,0.05,0.253%,296398436.00,United States,2012,27457,,
DCF,BNY Mellon Alcentra Global Credit Income 2024 Target Term Fund Inc. Common Stock,$9.51,-0.08,-0.834%,142299385.00,,2017,27588,,
DCI,Donaldson Company Inc. Common Stock,$64.62,0.68,1.063%,8150103543.00,United States,,358204,Capital Goods,Pollution Control Equipment
DCO,Ducommun Incorporated Common Stock,$54.06,1.24,2.348%,640589214.00,United States,,35858,Capital Goods,Military/Government/Technical
DCP,DCP Midstream  LP Common Units ,$27.60,0.50,1.845%,5750806987.00,United States,,563543,Public Utilities,Natural Gas Distribution
DCP^B,DCP Midstream LP 7.875% Series B Fixed-to-Floating Rate Cumulative Redeemable Perpetual Preferred Units,$24.3621,0.0271,0.111%,,United States,,25049,,
DCP^C,DCP Midstream LP 7.95% Series C Fixed-to-Floating Rate Cumulative Redeemable Perpetual Preferred Units,$24.95,-0.027,-0.108%,,United States,,3898,,
DCUE,Dominion Energy Inc. 2019 Series A Corporate Units,$100.3099,0.0699,0.07%,0.00,United States,2019,11463,Public Utilities,Electric Utilities: Central
DD,DuPont de Nemours Inc. Common Stock,$85.57,0.20,0.234%,45535419692.00,,2017,1693123,Capital Goods,Wholesale Distributors
DDD,3D Systems Corporation Common Stock,$30.00,-0.24,-0.794%,3751492770.00,United States,,3469028,Technology,Computer peripheral equipment
DDF,Delaware Investments Dividend & Income Fund Inc. Common Stock,$11.75,-0.02,-0.17%,89431118.00,United States,1993,15919,,
DDS,Dillard's Inc. Common Stock,$160.48,4.28,2.74%,3434272000.00,United States,,271654,Consumer Services,Department/Specialty Retail Stores
DDT,Dillard's Capital Trust I,$25.86,-0.03,-0.116%,0.00,United States,,25868,Consumer Services,Department/Specialty Retail Stores
DE,Deere & Company Common Stock,$356.64,-2.27,-0.632%,111251027691.00,United States,,1278944,Capital Goods,Industrial Machinery/Components
DEA,Easterly Government Properties Inc. Common Stock,$21.14,-0.06,-0.283%,1773031946.00,United States,2015,410257,Consumer Services,Real Estate Investment Trusts
DECK,Deckers Outdoor Corporation Common Stock,$323.98,-4.86,-1.478%,9010863192.00,United States,1993,371070,Consumer Non-Durables,Shoe Manufacturing
DEH,D8 Holdings Corp. Class A Ordinary Shares,$9.90,0.00,0.00%,426937500.00,Hong Kong,2020,39195,Finance,Business Services
DEI,Douglas Emmett Inc. Common Stock,$35.93,-0.31,-0.855%,6304660742.00,United States,2006,980729,Consumer Services,Real Estate Investment Trusts
DELL,Dell Technologies Inc. Class C Common Stock ,$103.53,1.87,1.839%,79063716376.00,,2018,2198145,Technology,Computer Manufacturing
DEN,Denbury Inc. Common Stock,$69.39,0.55,0.799%,3469960958.00,,2020,883007,Energy,Oil & Gas Production
DEO,Diageo plc Common Stock,$192.62,-0.26,-0.135%,112627660569.00,United Kingdom,,332674,Consumer Non-Durables,Beverages (Production/Distribution)
DESP,Despegar.com Corp. Ordinary Shares,$13.88,0.13,0.945%,972978673.00,,2017,233103,Transportation,Other Consumer Services
DEX,Delaware Enhanced Global Dividend Common Shares of Beneficial Interest,$10.43,0.05,0.482%,124101345.00,United States,2007,60670,,
DFIN,Donnelley Financial Solutions Inc. Common Stock ,$31.00,-0.24,-0.768%,1037420952.00,,2016,161956,Finance,Investment Managers
DFNS,LGL Systems Acquisition Corp. Common Stock,$9.95,0.01,0.101%,214546875.00,United States,2020,7101,,
DFP,Flaherty & Crumrine Dynamic Preferred and Income Fund Inc. Common Stock,$29.60,-0.06,-0.202%,568384765.00,,2013,39122,,
DFS,Discover Financial Services Common Stock,$123.38,0.80,0.653%,37617023081.00,United States,,1779989,Finance,Finance: Consumer Services
DG,Dollar General Corporation Common Stock,$206.76,0.76,0.369%,48837847112.00,United States,2009,1610780,Consumer Services,Department/Specialty Retail Stores
DGNR,Dragoneer Growth Opportunities Corp. Class A Ordinary Shares,$9.97,-0.01,-0.10%,859912500.00,United States,2020,84736,Finance,Business Services
DGX,Quest Diagnostics Incorporated Common Stock,$128.88,0.74,0.577%,15667394762.00,United States,,1092121,Health Care,Medical Specialities
DHF,BNY Mellon High Yield Strategies Fund Common Stock,$3.21,0.02,0.627%,233391678.00,United States,1998,360003,,
DHI,D.R. Horton Inc. Common Stock,$92.58,1.25,1.369%,33373564930.00,United States,,2336150,,
DHR,Danaher Corporation Common Stock,$242.27,1.26,0.523%,172806070866.00,United States,,1991978,Health Care,Medical Specialities
DHR^A,Danaher Corporation 4.75% Mandatory Convertible Preferred Stock Series A,$1654.64,0.00,0.00%,,United States,,3011,,
DHR^B,Danaher Corporation 5.00% Mandatory Convertible Preferred Stock Series B,$1364.58,-3.22,-0.235%,,United States,,31654,,
DHT,DHT Holdings Inc.,$6.15,-0.09,-1.442%,1054718875.00,Jersey,2005,1390448,Transportation,Marine Transportation
DHX,DHI Group Inc. Common Stock,$3.21,-0.02,-0.619%,167487088.00,United States,2007,122240,Technology,Diversified Commercial Services
DIAX,Nuveen Dow 30SM Dynamic Overwrite Fund Common Shares of Beneficial Interest,$17.43,0.13,0.751%,633875311.00,,2014,51550,,
DIN,Dine Brands Global Inc. Common Stock,$91.25,1.12,1.243%,1565607184.00,United States,,146782,Consumer Services,Restaurants
DIS,Walt Disney Company (The) Common Stock,$177.18,0.94,0.533%,321924022036.00,United States,,6341539,Consumer Services,Movies/Entertainment
DK,Delek US Holdings Inc. Common Stock,$24.95,0.28,1.135%,1843199314.00,United States,2017,616717,Energy,Integrated oil Companies
DKL,Delek Logistics Partners L.P. Common Units representing Limited Partner Interests,$42.39,-0.04,-0.094%,1841563013.00,United States,2012,14879,Energy,Oil & Gas Production
DKS,Dick's Sporting Goods Inc Common Stock,$97.47,1.70,1.775%,8701086176.00,United States,2002,1155090,Consumer Services,Other Specialty Stores
DLB,Dolby Laboratories Common Stock,$97.03,1.62,1.698%,9835043276.00,United States,2005,178177,Technology,EDP Services
DLNG,Dynagas LNG Partners LP Common Units,$2.75,0.00,0.00%,101188469.00,Greece,,73933,,
DLNG^A,Dynagas LNG Partners LP 9.00% Series A Cumulative Redeemable Preferred Units,$25.4782,-0.1018,-0.398%,,Greece,,5907,,
DLNG^B,Dynagas LNG Partners LP 8.75% Series B Fixed to Floating Rate Cumulative Redeemable Perpetual Preferred Units liquidation preference $25.00 per Uni,$23.89,-0.185,-0.768%,,Greece,,6077,,
DLR,Digital Realty Trust Inc. Common Stock,$155.18,-0.25,-0.161%,43696778045.00,United States,2004,1030137,Consumer Services,Real Estate Investment Trusts
DLR^J,Digital Realty Trust Inc. 5.250% Series J Cumulative Redeemable Preferred Stock,$26.58,-0.11,-0.412%,,United States,,18895,,
DLR^K,Digital Realty Trust Inc. 5.850% Series K Cumulative Redeemable Preferred Stock par value $0.01 per share,$28.3186,-0.0914,-0.322%,,United States,,22280,,
DLR^L,Digital Realty Trust Inc. 5.200% Series L Cumulative Redeemable Preferred Stock,$27.96,0.0063,0.023%,,United States,,19265,,
DLX,Deluxe Corporation Common Stock,$46.67,0.51,1.105%,1969547505.00,United States,,166753,Technology,Advertising
DLY,DoubleLine Yield Opportunities Fund Common Shares of Beneficial Interest,$19.80,-0.07,-0.352%,0.00,,2020,60504,,
DM,Desktop Metal Inc. Class A Common Stock,$14.84,0.25,1.714%,3795702588.00,,2019,4106645,Technology,Computer peripheral equipment
DMB,BNY Mellon Municipal Bond Infrastructure Fund Inc. Common Stock,$14.775,0.065,0.442%,271701065.00,,2013,37407,,
DMO,Western Asset Mortgage Opportunity Fund Inc. Common Stock,$15.14,0.15,1.001%,166950506.00,United States,2010,39062,,
DMS,Digital Media Solutions Inc. Class A Ordinary Shares,$10.69,0.04,0.376%,655095632.00,United States,2018,10994,Technology,Advertising
DMYI,dMY Technology Group Inc. III Class A Common Stock,$10.10,0.05,0.498%,378750000.00,United States,2021,184356,,
DMYQ,dMY Technology Group Inc. IV Class A Common Stock,$9.90,0.08,0.815%,426937500.00,,2021,44292,,
DNB,Dun & Bradstreet Holdings Inc. Common Stock,$21.71,0.35,1.639%,9365895946.00,United States,2020,898651,Technology,EDP Services
DNMR,Danimer Scientific Inc. Common Stock,$25.19,0.77,3.153%,2154664813.00,,2020,1656898,Consumer Non-Durables,Plastic Products
DNOW,NOW Inc. Common Stock,$11.11,0.02,0.18%,1224933083.00,,2014,543379,Energy,Metal Fabrications
DNP,DNP Select Income Fund Inc. Common Stock,$10.47,0.05,0.48%,3238397688.00,United States,1987,379225,,
DNZ,D and Z Media Acquisition Corp. Class A Common Stock,$9.80,0.00,0.00%,352187500.00,,2021,63,,
DOC,Physicians Realty Trust Common Shares of Beneficial Interest,$18.20,-0.02,-0.11%,3921543353.00,United States,2013,2149890,Consumer Services,Real Estate Investment Trusts
DOCN,DigitalOcean Holdings Inc. Common Stock,$40.07,0.05,0.125%,4269998043.00,,2021,117481,Technology,Retail: Computer Software & Peripheral Equipment
DOOR,Masonite International Corporation Ordinary Shares (Canada),$118.24,0.22,0.186%,2896975301.00,Canada,,99162,,
DOV,Dover Corporation Common Stock,$153.15,1.11,0.73%,22042461707.00,United States,,467153,Capital Goods,Industrial Machinery/Components
DOW,Dow Inc. Common Stock ,$70.37,-0.24,-0.34%,52565647034.00,,2019,3041871,Basic Industries,Industrial Specialties
DPG,Duff & Phelps Utility and Infrastructure Fund Inc.,$15.18,0.19,1.268%,575774455.00,United States,2011,103236,,
DPZ,Domino's Pizza Inc Common Stock,$431.14,6.02,1.416%,16740473358.00,United States,2004,516365,Consumer Non-Durables,Food Distributors
DQ,DAQO New Energy Corp. American Depositary Shares each representing five ordinary shares,$80.84,3.91,5.083%,5942837807.00,China,2010,3256639,Technology,Semiconductors
DRD,DRDGOLD Limited American Depositary Shares,$13.16,0.60,4.777%,1125329748.00,South Africa,,417594,Basic Industries,Precious Metals
DRE,Duke Realty Corporation Common Stock,$48.18,0.04,0.083%,18066790309.00,United States,,1825437,Consumer Services,Real Estate Investment Trusts
DRH,Diamondrock Hospitality Company Common Stock,$10.17,0.10,0.993%,2138260450.00,United States,2005,964395,Consumer Services,Real Estate Investment Trusts
DRH^A,Diamondrock Hospitality Company 8.250% Series A Cumulative Redeemable Preferred Stock,$29.035,0.085,0.294%,,United States,,6332,,
DRI,Darden Restaurants Inc. Common Stock,$134.15,-0.30,-0.223%,17552544717.00,United States,,1778346,Consumer Services,Restaurants
DRQ,Dril-Quip Inc. Common Stock,$38.24,0.82,2.191%,1354831499.00,United States,1997,186067,Energy,Metal Fabrications
DRUA,Dominion Energy Inc. 2016 Series A 5.25% Enhanced Junior Subordinated Notes due 2076,$25.33,0.07,0.277%,0.00,United States,2016,32773,,
DS,Drive Shack Inc.,$3.27,0.02,0.615%,301069479.00,United States,,1692286,Consumer Services,Movies/Entertainment
DS^B,Drive Shack Inc. Preferred Series B,$25.55,0.15,0.591%,,United States,,4017,,
DS^C,Drive Shack Inc. Preferred Series C,$24.745,0.24,0.979%,,United States,,100,,
DS^D,Drive Shack Inc. Pfd Ser D,$24.65,0.30,1.232%,,United States,,5807,,
DSE,Duff & Phelps Select MLP and Midstream Energy Fund Inc.,$9.34,0.14,1.522%,24502136.00,United States,2014,28057,,
DSL,DoubleLine Income Solutions Fund Common Shares of Beneficial Interests,$18.36,0.01,0.054%,1872661762.00,,2013,178887,,
DSM,BNY Mellon Strategic Municipal Bond Fund Inc. Common Stock,$8.20,-0.01,-0.122%,405256390.00,United States,1989,146583,,
DSSI,Diamond S Shipping Inc. Common Stock ,$10.25,-0.17,-1.631%,416096997.00,,2019,190969,Consumer Services,Transportation Services
DSU,Blackrock Debt Strategies Fund Inc. Common Stock,$11.35,0.03,0.265%,528817009.00,United States,1998,51843,,
DSX,Diana Shipping inc. common stock,$4.75,0.10,2.151%,434791260.00,Greece,2005,1047971,Transportation,Marine Transportation
DSX^B,Diana Shipping Inc. Perpetual Preferred Shares Series B (Marshall Islands),$25.75,-0.155,-0.598%,,Greece,,11161,,
DT,Dynatrace Inc. Common Stock,$50.93,1.04,2.085%,14446506114.00,United States,2019,869878,Technology,EDP Services
DTB,DTE Energy Company 2020 Series G 4.375% Junior Subordinated Debentures due 2080,$25.84,-0.11,-0.424%,0.00,United States,2020,14646,Public Utilities,Electric Utilities: Central
DTE,DTE Energy Company Common Stock,$137.34,-0.32,-0.232%,26606515760.00,United States,,836438,Public Utilities,Electric Utilities: Central
DTF,DTF Tax-Free Income Inc. Common Stock,$14.84,-0.02,-0.135%,104318759.00,United States,1991,104,,
DTJ,DTE Energy Company 2016 Series B 5.375% Junior Subordinated Debentures due 2076,$25.08,-0.005,-0.02%,0.00,United States,2016,68403,,
DTLA^,Brookfield DTLA Inc. 7.625% Series A Cumulative Redeemable Preferred Stock,$15.00,0.00,0.00%,,,,1604,,
DTP,DTE Energy Company 6.25% Corporate Units,$50.92,-0.17,-0.333%,0.00,United States,,144120,Public Utilities,Electric Utilities: Central
DTW,DTE Energy Company 2017 Series E 5.25% Junior Subordinated Debentures due 2077,$26.185,0.045,0.172%,0.00,United States,2017,6835,,
DTY,DTE Energy Company 2016 Series F 6.00% Junior Subordinated Debentures due 2076,$25.67,-0.0093,-0.036%,0.00,United States,2016,7955,,
DUK,Duke Energy Corporation (Holding Company) Common Stock,$101.48,-0.19,-0.187%,78060339655.00,United States,,2771390,Public Utilities,Power Generation
DUK^A,Duke Energy Corporation Depositary Shares each representing a 1/1000th interest in a share of 5.75% Series A Cumulative Redeemable Perpetual Preferred Stock,$28.34,0.05,0.177%,,United States,,44186,,
DUKB,Duke Energy Corporation 5.625% Junior Subordinated Debentures due 2078,$27.47,-0.02,-0.073%,0.00,United States,2018,15786,,
DUKH,Duke Energy Corporation 5.125% Junior Subordinated Debentures due 2073,$26.20,0.0828,0.317%,0.00,United States,,7482,Public Utilities,Power Generation
DV,DoubleVerify Holdings Inc. Common Stock,$35.22,0.53,1.528%,5536650495.00,,2021,184697,Technology,Computer Software: Prepackaged Software
DVA,DaVita Inc. Common Stock,$120.28,-0.85,-0.702%,12773736000.00,United States,,357783,Health Care,Medical/Nursing Services
DVD,Dover Motorsports Inc. Common Stock,$2.29,-0.01,-0.435%,83460403.00,United States,1996,15040,Consumer Services,Services-Misc. Amusement & Recreation
DVN,Devon Energy Corporation Common Stock,$31.66,0.49,1.572%,21430654000.00,United States,,9921271,Energy,Oil & Gas Production
DWIN,Delwinds Insurance Acquisition Corp. Class A Common Stock,$9.81,0.00,0.00%,252987638.00,,2021,37801,,
DX,Dynex Capital Inc. Common Stock,$19.88,0.02,0.101%,613885832.00,United States,,489032,Consumer Services,Real Estate Investment Trusts
DX^C,Dynex Capital Inc. 6.900% Series C Fixed-to-Floating Rate Cumulative Redeemable Preferred Stock,$25.71,-0.0583,-0.226%,,United States,,14027,,
DXC,DXC Technology Company Common Stock ,$39.89,-0.47,-1.165%,10164249874.00,,,1661413,Technology,EDP Services
DY,Dycom Industries Inc. Common Stock,$79.38,0.84,1.07%,2443212492.00,United States,,322339,Basic Industries,Water Supply
DYFN,Angel Oak Dynamic Financial Strategies Income Term Trust Common Shares of Beneficial Interest,$19.94,0.04,0.201%,80856700.00,,2020,20913,Finance,Finance/Investors Services
E,ENI S.p.A. Common Stock,$25.41,0.01,0.039%,45389243303.00,Italy,,219623,Energy,Oil & Gas Production
EAF,GrafTech International Ltd. Common Stock,$13.05,0.06,0.462%,3487805209.00,United States,2018,2707882,Consumer Durables,Metal Fabrications
EAI,Entergy Arkansas LLC First Mortgage Bonds 4.875% Series Due September 1 2066,$25.33,0.01,0.039%,0.00,United States,2016,16964,,
EARN,Ellington Residential Mortgage REIT Common Shares of Beneficial Interest,$12.62,0.09,0.718%,155775500.00,United States,2013,49618,Consumer Services,Real Estate Investment Trusts
EAT,Brinker International Inc. Common Stock,$56.53,0.67,1.199%,2586299395.00,United States,,1373447,Consumer Services,Restaurants
EB,Eventbrite Inc. Class A Common Stock,$20.73,0.33,1.618%,1942800322.00,United States,2018,1051417,Technology,EDP Services
EBF,Ennis Inc. Common Stock,$21.11,0.02,0.095%,551040325.00,United States,,57014,Consumer Services,Office Equipment/Supplies/Services
EBR,Centrais Electricas Brasileiras S A American Depositary Shares (Each representing one Common Share),$9.03,0.21,2.381%,14167446117.00,,2016,637192,Public Utilities,Electric Utilities: Central
EBS,Emergent Biosolutions Inc. Common Stock,$64.40,2.76,4.478%,3450904783.00,United States,2006,742889,Health Care,Major Pharmaceuticals
EC,Ecopetrol S.A. American Depositary Shares,$13.04,0.18,1.40%,26808084931.00,Colombia,,781134,Energy,Oil & Gas Production
ECC           ,Eagle Point Credit Company Inc. Common Stock,$14.39,0.09,0.629%,465586867.00,United States,2014,182498,Finance,Trusts Except Educational Religious and Charitable
ECCB,Eagle Point Credit Company Inc. 7.75% Series B Term Preferred Stock due 2026,$25.50,0.01,0.039%,0.00,United States,2016,26871,Finance,Trusts Except Educational Religious and Charitable
ECCW,Eagle Point Credit Company Inc. 6.75% Notes due 2031,$25.85,0.10,0.388%,0.00,United States,2021,8958,Finance,Trusts Except Educational Religious and Charitable
ECCX,Eagle Point Credit Company Inc. 6.6875% Notes due 2028,$25.59,0.07,0.274%,0.00,United States,2018,1724,,
ECCY,Eagle Point Credit Company Inc. 6.75% Notes due 2027,$25.70,-0.05,-0.194%,0.00,United States,2017,7425,,
ECL,Ecolab Inc. Common Stock,$215.46,1.61,0.753%,61608071342.00,United States,,971238,Consumer Non-Durables,Package Goods/Cosmetics
ECOM          ,ChannelAdvisor Corporation Common Stock,$24.37,0.43,1.796%,724589603.00,United States,2013,95809,Technology,Computer Software: Prepackaged Software
ED,Consolidated Edison Inc. Common Stock,$77.24,-0.02,-0.026%,26478896048.00,United States,,1418931,Public Utilities,Power Generation
EDD,Morgan Stanley Emerging Markets Domestic Debt Fund Inc. Morgan Stanley Emerging Markets Domestic Debt Fund Inc. Common Stock,$6.30,0.05,0.80%,416380388.00,United States,2007,123998,,
EDF,Stone Harbor Emerging Markets Income Fund Common Shares of Beneficial Interest,$8.50,0.03,0.354%,141744895.00,United States,2010,84547,,
EDI,Stone Harbor Emerging Markets Total Income Fund Common Shares of Beneficial Interests,$8.98,0.03,0.335%,88705859.00,United States,2012,20952,,
EDN,Empresa Distribuidora Y Comercializadora Norte S.A. (Edenor) Empresa Distribuidora Y Comercializadora Norte S.A. (Edenor) American Depositary Shares,$4.30,0.14,3.365%,194887847.00,Argentina,2007,59384,Public Utilities,Electric Utilities: Central
EDR,Endeavor Group Holdings Inc. Class A Common Stock,$29.17,0.07,0.241%,7401895405.00,,2021,476979,Consumer Services,Services-Misc. Amusement & Recreation
EDU,New Oriental Education & Technology Group Inc. Sponsored ADR representing 1 Ordinary Share (Cayman Islands),$9.22,-0.10,-1.073%,15689294781.00,China,2006,46873501,Miscellaneous,Other Consumer Services
EEA,The European Equity Fund Inc. Common Stock,$11.80,0.07,0.597%,83488446.00,United States,,1699,,
EEX,Emerald Holding Inc. Common Stock,$5.17,-0.13,-2.453%,372753970.00,United States,2017,82411,Technology,Advertising
EFC,Ellington Financial Inc. Common Stock ,$18.96,0.02,0.106%,830100729.00,United States,2010,351391,Finance,Real Estate
EFC^A,Ellington Financial Inc. 6.750% Series A Fixed-to-Floating Rate Cumulative Redeemable Preferred Stock,$25.45,0.076,0.30%,,United States,,4732,,
EFF,Eaton vance Floating-Rate Income Plus Fund Common Shares of Beneficial Interest,$16.39,0.01,0.061%,124669257.00,,2013,21778,Finance,Investment Managers
EFL,Eaton Vance Floating-Rate 2022 Target Term Trust Common Shares of Beneficial Interest,$9.41,0.00,0.00%,222279369.00,United States,2017,41108,,
EFR,Eaton Vance Senior Floating-Rate Fund Common Shares of Beneficial Interest,$14.12,-0.03,-0.212%,520298180.00,United States,2003,162322,,
EFT,Eaton Vance Floating Rate Income Trust Common Shares of Beneficial Interest,$14.37,0.07,0.49%,572841225.00,United States,2004,84811,,
EFX,Equifax Inc. Common Stock,$233.40,4.42,1.93%,28405369568.00,United States,,427224,Technology,Advertising
EGF,Blackrock Enhanced Government Fund Inc. Common Stock,$12.62,0.01,0.079%,53783613.00,United States,2005,2320,,
EGHT,8x8 Inc Common Stock,$23.03,-0.07,-0.303%,2530811079.00,United States,,1269530,Technology,EDP Services
EGO,Eldorado Gold Corporation Ordinary Shares,$11.60,0.11,0.957%,2108961548.00,Canada,,850922,Basic Industries,Precious Metals
EGP,EastGroup Properties Inc. Common Stock,$164.48,-0.41,-0.249%,6582742406.00,United States,,201584,Consumer Services,Real Estate Investment Trusts
EGY,VAALCO Energy Inc.  Common Stock,$3.09,0.03,0.98%,179005440.00,United States,,226021,Energy,Oil & Gas Production
EHC,Encompass Health Corporation Common Stock,$81.95,-0.82,-0.991%,8157500500.00,United States,,633538,Health Care,Medical Specialities
EHI,Western Asset Global High Income Fund Inc Common Stock,$10.441,0.021,0.202%,236982478.00,United States,2003,15045,,
EHT,Eaton Vance 2021 Target Term Trust Common Shares of Beneficial Interest,$9.83,0.00,0.00%,211006081.00,United States,2016,18773,,
EIC,Eagle Point Income Company Inc. Common Stock,$15.73,0.03,0.191%,0.00,,2019,4256,Finance,Finance/Investors Services
EIG,Employers Holdings Inc Common Stock,$42.11,-0.32,-0.754%,1201069421.00,United States,2007,136952,Finance,Property-Casualty Insurers
EIX,Edison International Common Stock,$56.47,0.24,0.427%,21426866853.00,United States,,1366873,Public Utilities,Electric Utilities: Central
EL,Estee Lauder Companies Inc. (The) Common Stock,$303.35,0.47,0.155%,109967976978.00,United States,1995,903379,Consumer Non-Durables,Package Goods/Cosmetics
ELAN,Elanco Animal Health Incorporated Common Stock,$34.18,-0.82,-2.343%,16167002015.00,United States,2018,3764494,Health Care,Major Pharmaceuticals
ELAT,Elanco Animal Health Incorporated 5.00% Tangible Equity Units,$52.22,-1.19,-2.228%,0.00,United States,2020,94902,Health Care,Major Pharmaceuticals
ELC,Entergy Louisiana Inc. Collateral Trust Mortgage Bonds 4.875 % Series due September 1 2066,$25.35,-0.05,-0.197%,0.00,United States,2016,9967,,
