Symbol,Name,Last Sale,Net Change,% Change,Market Cap,Country,IPO Year,Volume,Sector,Industry
PSA^O,Public Storage Depositary Shares Each Representing 1/1000 of a 3.900% Cumulative Preferred Share of Beneficial Interest Series O,$26.14,-0.01,-0.038%,,United States,,24252,,
PSB,PS Business Parks Inc. (MD) Common Stock,$158.20,-0.92,-0.578%,4355088907.00,United States,,86903,Consumer Services,Real Estate Investment Trusts
PSB^W,PS Business Parks Inc. Depositary Shares Each Representing 1/1000 of a Share of 5.20% Cumulative Preferred Stock Series W,$25.94,0.0538,0.208%,,United States,,4884,,
PSB^X,PS Business Parks Inc. Depositary Shares Each Representing 1/1000 of a Share of 5.25% Cumulative Preferred Stock Series X,$26.78,-0.16,-0.594%,,United States,,10226,,
PSB^Y,PS Business Parks Inc. 5.20% Cumulative Preferred Stock Series Y,$26.62,-0.06,-0.225%,,United States,,4240,,
PSB^Z,PS Business Parks Inc. Depositary Shares Each Representing 1/1000 of a Share of 4.875% Cumulative Preferred Stock Series Z  par value $0.01 per share,$27.48,0.15,0.549%,,United States,,23986,,
PSF,Cohen & Steers Select Preferred and Income Fund Inc. Common Stock,$29.30,0.08,0.274%,352086028.00,,2010,14787,,
PSFE,Paysafe Limited Common Shares,$12.26,0.44,3.723%,8872713803.00,,2021,12864910,Miscellaneous,Business Services
PSN,Parsons Corporation Common Stock,$40.68,1.23,3.118%,4165982173.00,,2019,662840,Capital Goods,Industrial Machinery/Components
PSO,Pearson Plc Common Stock,$12.01,0.14,1.179%,9082379804.00,United Kingdom,,139849,Consumer Services,Books
PSTG,Pure Storage Inc. Class A Common Stock,$18.68,0.11,0.592%,5291855650.00,,2015,2678453,Technology,Electronic Components
PSTH,Pershing Square Tontine Holdings Ltd. Class A Common Stock,$22.06,-2.99,-11.936%,4412002206.00,,2020,22587135,,
PSTL,Postal Realty Trust Inc. Class A Common Stock,$20.30,-0.02,-0.098%,271427687.00,,2019,70682,Consumer Services,Real Estate Investment Trusts
PSX,Phillips 66 Common Stock,$91.48,2.27,2.545%,40056078100.00,United States,,3267310,Energy,Integrated oil Companies
PSXP,Phillips 66 Partners LP Common Units representing limited partner interest in the Partnership,$39.69,-1.08,-2.649%,9062820395.00,United States,2013,701521,Energy,Oil & Gas Production
PTA,Cohen & Steers Tax-Advantaged Preferred Securities and Income Fund Common Shares of Beneficial Interest,$25.50,0.18,0.711%,1409473154.00,,2020,73298,,
PTR,PetroChina Company Limited Common Stock,$43.88,0.65,1.504%,80309605059.00,China,,140396,Energy,Oil & Gas Production
PTY,Pimco Corporate & Income Opportunity Fund,$20.18,0.08,0.398%,2232245228.00,United States,2002,408395,,
PUK,Prudential Public Limited Company Common Stock,$42.01,-0.02,-0.048%,54940907417.00,United Kingdom,,176836,Finance,Life Insurance
PUK^,Prudential Public Limited Company 6.75% Perpetual Subordinated Captial Security,$28.46,0.13,0.459%,,United Kingdom,,8921,,
PUK^A,Prudential Public Limited Company 6.50% Perpetual Subordinated Capital Securities Exchangeable at the Issuer's Option Into Non-Cumulative Dollar Denominated Preference Shares,$28.34,0.19,0.675%,,United Kingdom,,6907,,
PUMP,ProPetro Holding Corp. Common Stock,$11.37,0.08,0.709%,1162927363.00,United States,2017,705807,Energy,Oilfield Services/Equipment
PV,Primavera Capital Acquisition Corporation Class A Ordinary Shares,$9.72,0.01,0.103%,522450000.00,,2021,83484,Finance,Business Services
PVG,Pretium Resources Inc. Ordinary Shares (Canada),$10.80,0.06,0.559%,2028597307.00,Canada,,916867,,
PVH,PVH Corp. Common Stock,$110.04,-0.55,-0.497%,7842106018.00,United States,,973834,,
PVL,Permianville Royalty Trust Trust Units ,$1.80,0.07,4.046%,59400000.00,United States,2011,102404,Energy,Oil & Gas Production
PWR,Quanta Services Inc. Common Stock,$93.16,-0.30,-0.321%,12981481931.00,United States,,851283,Capital Goods,Engineering & Construction
PXD,Pioneer Natural Resources Company Common Stock,$170.30,0.20,0.118%,41545093890.00,United States,,1889080,Energy,Oil & Gas Production
PYN,PIMCO New York Municipal Income Fund III Common Shares of Beneficial Interest,$10.89,0.24,2.254%,62377920.00,United States,2002,3872,,
PYS,Merrill Lynch Depositor Inc PPlus Tr Ser RRD-1 Tr Ctf Cl A,$21.85,0.0025,0.011%,0.00,United States,,723,Finance,Trusts Except Educational Religious and Charitable
PYT,PPlus Tr GSC-2 Tr Ctf Fltg Rate,$24.12,-0.2145,-0.881%,0.00,United States,,7296,,
PZC,PIMCO California Municipal Income Fund III Common Shares of Beneficial Interest,$11.16,0.10,0.904%,249771960.00,United States,2002,19160,,
PZN,Pzena Investment Management Inc Class A Common Stock,$11.99,-0.04,-0.333%,870084553.00,United States,2007,76088,Finance,Investment Managers
QD,Qudian Inc. American Depositary Shares each representing one Class A Ordinary Share,$2.18,0.04,1.869%,551732272.00,China,2017,2158218,Technology,Computer Software: Prepackaged Software
QFTA,Quantum FinTech Acquisition Corporation Common Stock,$9.74,0.09,0.933%,245021875.00,,2021,16485,,
QGEN,Qiagen N.V. Common Shares ,$46.57,-0.06,-0.129%,10636913990.00,Netherlands,,712514,Health Care,Biotechnology: Biological Products (No Diagnostic Substances)
QS,QuantumScape Corporation Class A Common Stock,$28.57,0.15,0.528%,11598675552.00,United States,2020,9551585,Capital Goods,Auto Parts:O.E.M.
QSR,Restaurant Brands International Inc. Common Shares,$69.18,0.06,0.087%,20969375258.00,Canada,2014,542551,,
QTS,QTS Realty Trust Inc. Class A Common Stock,$64.49,-0.59,-0.907%,4443486756.00,United States,2013,502720,Consumer Services,Real Estate Investment Trusts
QTS^A,QTS Realty Trust Inc. 7.125% Series A Cumulative Redeemable Perpetual Preferred Stock,$27.98,0.04,0.143%,,United States,,3435,,
QTS^B,QTS Realty Trust Inc. 6.50% Series B Cumulative Convertible Perpetual Preferred Stock,$145.03,-1.58,-1.078%,,United States,,848,,
QTWO,Q2 Holdings Inc. Common Stock,$95.23,0.14,0.147%,5361954671.00,,2014,374358,Technology,EDP Services
QUAD,Quad Graphics Inc Class A Common Stock,$3.62,-0.06,-1.63%,197943070.00,United States,,352095,Consumer Services,Recreational Products/Toys
QUOT,Quotient Technology Inc. Common Stock,$11.33,-0.11,-0.962%,1057796332.00,,2014,323697,Technology,Advertising
QVCC,QVC Inc. 6.250% Senior Secured Notes due 2068,$26.01,-0.04,-0.154%,0.00,United States,2019,24833,,
QVCD,QVC Inc. 6.375% Senior Secured Notes due 2067,$25.83,-0.07,-0.27%,0.00,United States,2018,10301,,
R,Ryder System Inc. Common Stock,$80.61,-2.26,-2.727%,4342491896.00,United States,,537999,Miscellaneous,Rental/Leasing Companies
RA,Brookfield Real Assets Income Fund Inc. Common Stock,$21.89,0.05,0.229%,960815647.00,,2016,191129,,
RAAS,Cloopen Group Holding Limited American Depositary Shares each representing two Class A Ordinary Shares,$9.23,-0.14,-1.494%,1517136706.00,,2021,487337,Technology,Computer Software: Prepackaged Software
RACE,Ferrari N.V. Common Shares,$216.88,1.45,0.673%,53783037767.00,,2015,265552,Capital Goods,Auto Manufacturing
RAD,Rite Aid Corporation Common Stock,$20.86,-0.07,-0.334%,1149464058.00,United States,,1672171,Health Care,Medical/Nursing Services
RAMP,LiveRamp Holdings Inc. Common Stock,$49.08,0.03,0.061%,3357729721.00,United States,2018,414407,Technology,EDP Services
RBA,Ritchie Bros. Auctioneers Incorporated Common Stock,$59.59,-0.23,-0.384%,6571621609.00,Canada,,227132,,
RBAC,RedBall Acquisition Corp. Class A Ordinary Shares,$9.80,-0.02,-0.204%,704375000.00,United States,2020,509107,Finance,Business Services
RBC,Regal Beloit Corporation Common Stock,$141.60,1.17,0.833%,5753195964.00,United States,,229761,Consumer Durables,Metal Fabrications
RBLX,Roblox Corporation Class A Common Stock,$99.57,3.07,3.181%,56738118771.00,,2021,14648363,Technology,EDP Services
RC,Ready Capital Corproation Common Stock,$15.44,0.17,1.113%,1099663033.00,United States,2013,301185,Consumer Services,Real Estate Investment Trusts
RC^B,Ready Capital Corporation 8.625% Series B Cumulative Preferred Stock,$25.51,0.04,0.157%,,United States,,14299,,
RC^C,Ready Capital Corporation 6.25% Series C Cumulative Convertible Preferred Stock,$25.36,0.01,0.039%,,United States,,280,,
RC^D,Ready Capital Corporation 7.625% Series D Cumulative Redeemable Preferred Stock,$25.41,0.01,0.039%,,United States,,33839,,
RCA,Ready Capital Corporation 7.00% Convertible Senior Notes due 2023,$26.28,0.04,0.152%,0.00,United States,2017,9420,,
RCB,Ready Capital Corporation 6.20% Senior Notes due 2026,$26.28,-0.22,-0.83%,0.00,United States,2019,2064,,
RCC,Ready Capital Corporation 5.75% Senior Notes due 2026,$25.57,0.06,0.235%,,United States,2021,284206,Finance,Finance Companies
RCI,Rogers Communication Inc. Common Stock,$52.25,0.72,1.397%,26382347866.00,Canada,,2561024,,
RCL,D/B/A Royal Caribbean Cruises Ltd. Common Stock,$94.07,-0.65,-0.686%,23947461704.00,United States,1993,2716581,,
RCS,PIMCO Strategic Income Fund Inc.,$7.79,-0.05,-0.638%,345337524.00,United States,1994,101075,,
RCUS,Arcus Biosciences Inc. Common Stock,$25.05,0.26,1.049%,1778446293.00,,2018,311002,Health Care,Major Pharmaceuticals
RDN,Radian Group Inc. Common Stock,$22.94,0.03,0.131%,4388801818.00,United States,,1055317,Finance,Property-Casualty Insurers
RDS/B,Royal Dutch Shell PLC,$37.71,-0.18,-0.475%,,Netherlands,,3311788,,
RDY,Dr. Reddy's Laboratories Ltd Common Stock,$72.27,0.30,0.417%,12018589964.00,India,,42081,Health Care,Major Pharmaceuticals
RE,Everest Re Group Ltd. Common Stock,$259.37,2.37,0.922%,10396463879.00,Bermuda,,227166,Finance,Property-Casualty Insurers
RELX,RELX PLC PLC American Depositary Shares (Each representing One Ordinary Share),$26.28,0.11,0.42%,50807304570.00,United Kingdom,2015,367723,Consumer Services,Publishing
RENN,Renren Inc. American Depositary Shares each representing fifteen Class A ordinary shares,$11.86,-0.51,-4.123%,284869562.00,China,2011,83228,Technology,EDP Services
RES,RPC Inc. Common Stock,$6.14,0.07,1.153%,1324613047.00,United States,,963830,Energy,Oilfield Services/Equipment
REV,Revlon Inc. New Common Stock,$14.43,-0.27,-1.837%,771808348.00,United States,1996,158863,Consumer Non-Durables,Package Goods/Cosmetics
REVG,REV Group Inc. Common Stock,$19.26,0.65,3.493%,1246857077.00,United States,2017,174609,Capital Goods,Industrial Machinery/Components
REX,REX American Resources Corporation,$92.58,-0.42,-0.452%,554739360.00,United States,,17077,Basic Industries,Automotive Aftermarket
REXR,Rexford Industrial Realty Inc. Common Stock,$56.28,-0.28,-0.495%,7545029002.00,United States,2013,656912,Consumer Services,Real Estate Investment Trusts
REXR^A,Rexford Industrial Realty Inc. 5.875% Series A Cumulative Redeemable Preferred Stock,$25.47,0.00,0.00%,,United States,,450,,
REXR^B,Rexford Industrial Realty Inc. 5.875% Series B Cumulative Redeemable Preferred Stock,$26.4175,0.0175,0.066%,,United States,,373,,
REXR^C,Rexford Industrial Realty Inc. 5.625% Series C Cumulative Redeemable Preferred Stock par value $0.01 per share,$27.88,0.105,0.378%,,United States,,227,,
REZI,Resideo Technologies Inc. Common Stock ,$31.81,0.77,2.481%,4575881001.00,,2018,649270,Miscellaneous,Diversified Manufacture
RF,Regions Financial Corporation Common Stock,$22.63,-0.31,-1.351%,21753888511.00,United States,,8759524,Finance,Major Banks
RF^A,Regions Financial Corporation Depositary Shares Representing 1/40th Perpetual Preferred Series A,$24.99,-0.05,-0.20%,,United States,,60398,,
RF^B,Regions Financial Corporation Depositary Shares Representing 1/40th Perpetual Preferred Series B,$29.15,0.23,0.795%,,United States,,24977,,
RF^C,Regions Financial Corporation Depositary Shares each Representing a 1/40th Interest in a  Share of 5.700% Fixed-to-Floating Rate Non-Cumulative  Perpetual Preferred Stock Series C,$28.74,0.27,0.948%,,United States,,25148,,
RF^E,Regions Financial Corporation Depositary Shares Each Representing a 1/40th Interest in a Share of 4.45% Non-Cumulative Perpetual Preferred Stock Series E,$25.03,0.13,0.522%,,United States,,218531,,
RFI,Cohen & Steers Total Return Realty Fund Inc. Common Stock,$15.98,0.31,1.978%,419484572.00,United States,1993,46815,,
RFL,Rafael Holdings Inc. Class B Common Stock,$46.68,-0.31,-0.66%,782264094.00,United States,2018,134469,Health Care,Major Pharmaceuticals
RFM,RiverNorth Flexible Municipal Income Fund Inc. Common Stock,$23.95,0.04,0.167%,146447041.00,,2020,4113,,
RFMZ,RiverNorth Flexible Municipal Income Fund II Inc. Common Stock,$20.40,-0.05,-0.244%,0.00,,2021,38719,,
RFP,Resolute Forest Products Inc. Common Stock,$14.27,-0.09,-0.627%,1128630240.00,Canada,,677256,Basic Industries,Paper
RGA,Reinsurance Group of America Incorporated Common Stock,$128.56,0.84,0.658%,8740182840.00,United States,,183063,Finance,Life Insurance
RGR,Sturm Ruger & Company Inc. Common Stock,$79.33,-0.50,-0.626%,1394906988.00,United States,,101636,,
RGS,Regis Corporation Common Stock,$9.31,-0.19,-2.00%,333203224.00,United States,1991,160731,,
RGT,Royce Global Value Trust Inc. Common Stock,$15.06,0.13,0.871%,84347912.00,,2013,3791,,
RH,RH Common Stock,$613.22,1.68,0.275%,12896184622.00,United States,2012,403952,Consumer Services,Other Specialty Stores
RHI,Robert Half International Inc. Common Stock,$90.38,0.31,0.344%,10193109905.00,United States,,410007,Technology,Diversified Commercial Services
RHP,Ryman Hospitality Properties Inc. (REIT),$74.53,-0.64,-0.851%,4103984687.00,United States,,225849,Consumer Services,Real Estate Investment Trusts
RICE,Rice Acquisition Corp. Class A Common Stock,$16.10,-0.01,-0.062%,477507485.00,United States,2020,66892,,
RIG,Transocean Ltd (Switzerland) Common Stock,$4.42,-0.10,-2.212%,2728461381.00,Switzerland,,20264423,Energy,Oil & Gas Production
RIO,Rio Tinto Plc Common Stock,$89.75,1.24,1.401%,145302734667.00,Australia,2002,2470627,Basic Industries,Steel/Iron Ore
RIV,RiverNorth Opportunities Fund Inc. Common Stock,$17.905,0.105,0.59%,181862876.00,,2015,88264,Finance,Finance Companies
RJF,Raymond James Financial Inc. Common Stock,$132.43,-0.47,-0.354%,18198279778.00,United States,,442377,Finance,Investment Bankers/Brokers/Service
RKT,Rocket Companies Inc. Class A Common Stock,$19.77,0.21,1.074%,2698090426.00,United States,2020,9682603,Finance,Finance: Consumer Services
RKTA,Rocket Internet Growth Opportunities Corp. Class A Ordinary Shares,$9.69,-0.04,-0.411%,323403750.00,,2021,275702,,
RL,Ralph Lauren Corporation Common Stock,$120.77,-0.37,-0.305%,8832068550.00,United States,1997,706414,Consumer Non-Durables,Apparel
RLGY,Realogy Holdings Corp. Common Stock,$17.70,-0.04,-0.225%,2060710606.00,United States,2012,784508,Finance,Real Estate
RLI,RLI Corp. Common Stock (DE),$103.91,0.20,0.193%,4697089243.00,United States,,71814,Finance,Property-Casualty Insurers
RLJ,RLJ Lodging Trust Common Shares of Beneficial Interest $0.01 par value,$15.47,0.02,0.129%,2551277593.00,United States,2011,410607,Consumer Services,Real Estate Investment Trusts
RLJ^A,RLJ Lodging Trust $1.95 Series A Cumulative Convertible  Preferred Shares,$28.50,0.15,0.529%,,United States,,10136,,
RLX,RLX Technology Inc. American Depositary Shares each representing the right to receive one (1) Class A ordinary share,$9.90,-0.97,-8.924%,15550826643.00,,2021,9380630,Consumer Non-Durables,Farming/Seeds/Milling
RM,Regional Management Corp. Common Stock,$47.03,-0.97,-2.021%,499782919.00,United States,2012,164820,Finance,Finance: Consumer Services
RMAX,RE/MAX Holdings Inc. Class A Common Stock,$34.59,0.23,0.669%,1087862487.00,,2013,55014,Finance,Real Estate
RMD,ResMed Inc. Common Stock,$205.31,1.38,0.677%,29876266088.00,United States,,488554,Health Care,Medical/Dental Instruments
RMI,RiverNorth Opportunistic Municipal Income Fund Inc. Common Stock,$23.06,0.02,0.087%,146967560.00,,2018,6471,,
RMM,RiverNorth Managed Duration Municipal Income Fund Inc. Common Stock,$20.28,0.14,0.695%,400317405.00,,2019,39083,,
RMO,Romeo Power Inc. Class A Common Stock,$9.15,-0.41,-4.289%,1200455753.00,,2019,3071424,Capital Goods,Automotive Aftermarket
RMPL^,RiverNorth Specialty Finance Corporation 5.875% ,$25.42,0.00,0.00%,,,,1008,,
RMT,Royce Micro-Cap Trust Inc. Common Stock,$12.32,0.06,0.489%,539182188.00,United States,,92267,,
RNG,RingCentral Inc. Class A Common Stock,$246.74,-1.78,-0.716%,22422006487.00,,2013,995159,Technology,EDP Services
RNGR,Ranger Energy Services Inc. Class A Common Stock,$7.965,0.035,0.441%,135181757.00,United States,2017,3251,Energy,Oilfield Services/Equipment
RNP,Cohen & Steers REIT and Preferred and Income Fund Inc. Common Shares,$26.88,0.05,0.186%,1279009348.00,United States,2003,58458,,
RNR,RenaissanceRe Holdings Ltd. Common Stock,$150.75,-0.02,-0.013%,7482885687.00,Bermuda,,259149,Finance,Property-Casualty Insurers
RNR^E,RenaissanceRe Holdings Ltd. 5.375% Series E Preference Shares,$25.28,0.00,0.00%,,Bermuda,,4019,,
RNR^F,RenaissanceRe Holdings Ltd. Depositary Shares each Representing a 1/1000th Interest in a 5.750% Series F Preference Share,$26.79,0.05,0.187%,,Bermuda,,39801,,
ROG,Rogers Corporation Common Stock,$192.03,1.86,0.978%,3593294933.00,United States,,38781,Capital Goods,Industrial Machinery/Components
ROK,Rockwell Automation Inc. Common Stock,$275.62,1.18,0.43%,31993058676.00,United States,,502226,Capital Goods,Industrial Machinery/Components
ROL,Rollins Inc. Common Stock,$33.19,0.10,0.302%,16333579496.00,United States,,713816,Technology,Industrial Specialties
ROP,Roper Technologies Inc. Common Stock,$451.05,3.95,0.883%,47468063579.00,United States,1992,232375,Capital Goods,Office Equipment/Supplies/Services
ROSS,Ross Acquisition Corp II Class A Ordinary Shares,$9.75,-0.01,-0.102%,420468750.00,,2021,607,,
ROT,Rotor Acquisition Corp. Class A Common Stock,$9.91,-0.01,-0.101%,341895000.00,,2021,121377,,
RPAI,Retail Properties of America Inc. Class A Common Stock,$12.25,-0.14,-1.13%,2630473836.00,United States,2012,976675,Consumer Services,Real Estate Investment Trusts
RPM,RPM International Inc. Common Stock,$94.94,1.21,1.291%,12295806050.00,United States,,304503,Basic Industries,Paints/Coatings
RPT,RPT Realty Common Stock,$13.06,-0.13,-0.986%,1060015331.00,United States,,334638,Consumer Services,Real Estate Investment Trusts
RPT^D,RPT Realty 7.25% ,$57.215,-0.035,-0.061%,,United States,,1017,,
RQI,Cohen & Steers Quality Income Realty Fund Inc Common Shares,$15.93,0.10,0.632%,2138494638.00,United States,2002,346314,,
RRC,Range Resources Corporation Common Stock,$14.23,-0.18,-1.249%,3551677525.00,United States,,4862649,Energy,Oil & Gas Production
RRD,R.R. Donnelley & Sons Company Common Stock,$6.38,-0.22,-3.333%,460636000.00,United States,,763551,Consumer Services,Advertising
RS,Reliance Steel & Aluminum Co. Common Stock (DE),$170.45,0.97,0.572%,10859001669.00,United States,1994,231428,Basic Industries,Steel/Iron Ore
RSF,RiverNorth Specialty Finance Corporation,$19.05,0.0043,0.023%,98442761.00,,2019,31239,,
RSG,Republic Services Inc. Common Stock,$109.23,0.34,0.312%,34848019484.00,United States,1998,866244,Public Utilities,Environmental Services
RSI,Rush Street Interactive Inc. Class A Common Stock,$13.15,-0.11,-0.83%,2881945637.00,,2020,685542,Consumer Services,Services-Misc. Amusement & Recreation
RTP,Reinvent Technology Partners Class A Ordinary Shares,$10.01,0.01,0.10%,863362500.00,United States,2020,1091419,Finance,Business Services
RTPZ,Reinvent Technology Partners Z Class A Ordinary Shares,$10.00,0.025,0.251%,287500000.00,United States,2021,10818,Finance,Business Services
RTX,Raytheon Technologies Corporation Common Stock,$89.02,0.34,0.383%,134873300227.00,United States,,4082785,Capital Goods,Military/Government/Technical
RVI,Retail Value Inc. Common Stock ,$18.84,0.55,3.007%,397208468.00,United States,2018,113126,Consumer Services,Real Estate Investment Trusts
RVLV,Revolve Group Inc. Class A Common Stock,$56.51,-1.95,-3.336%,4080384060.00,,2019,539582,Consumer Services,Catalog/Specialty Distribution
RVT,Royce Value Trust Inc. Common Stock,$19.37,0.07,0.363%,1975211141.00,United States,1986,136454,,
RWT,Redwood Trust Inc. Common Stock,$11.52,0.26,2.309%,1301880925.00,United States,1995,1076366,Consumer Services,Real Estate Investment Trusts
RXN,Rexnord Corporation Common Stock,$50.32,0.34,0.68%,6024363739.00,United States,2012,803139,Technology,Industrial Machinery/Components
RY,Royal Bank Of Canada Common Stock,$104.49,0.27,0.259%,148908322105.00,Canada,,772753,,
RY^T,Royal Bank Of Canada 6.750% Fixed Rate/Floating Rate Noncumulative First Preferred Shares Series C-2,$28.70,-0.0504,-0.175%,,Canada,,255,,
RYAM,Rayonier Advanced Materials Inc. Common Stock,$7.83,-0.05,-0.635%,497967274.00,United States,2014,280444,Basic Industries,Industrial Specialties
RYB,RYB Education Inc. American depositary shares each representing one Class A ordinary share,$4.35,0.12,2.837%,120000605.00,,2017,71621,Miscellaneous,Other Consumer Services
RYI,Ryerson Holding Corporation Common Stock,$16.62,0.33,2.026%,639447752.00,United States,2014,62194,Capital Goods,Office Equipment/Supplies/Services
RYN,Rayonier Inc. REIT Common Stock,$36.64,-0.41,-1.107%,5094057038.00,United States,,1120229,Consumer Services,Real Estate Investment Trusts
RZA,Reinsurance Group of America Incorporated 6.20% Fixed-to-Floating Rate Subordinated Debentures due 2042,$26.26,0.04,0.153%,0.00,United States,,27115,Finance,Life Insurance
RZB,Reinsurance Group of America Incorporated 5.75% Fixed-To-Floating Rate Subordinated Debentures due 2056,$27.96,0.07,0.251%,0.00,United States,2016,16703,,
SA,Seabridge Gold Inc. Ordinary Shares (Canada),$18.92,0.41,2.215%,1427310951.00,Canada,,255283,Basic Industries,Precious Metals
SAF,Saratoga Investment Corp 6.25% Notes due 2023,$25.40,0.00,0.00%,0.00,United States,2018,4380,Finance,Finance Companies
SAFE,Safehold Inc. Common Stock,$71.10,-0.11,-0.154%,3786986502.00,United States,2017,93078,Consumer Services,Real Estate Investment Trusts
SAH,Sonic Automotive Inc. Common Stock,$47.63,-0.57,-1.183%,1981159276.00,United States,1997,232001,Consumer Services,Other Specialty Stores
SAIC,SCIENCE APPLICATIONS INTERNATIONAL CORPORATION Common Stock,$93.84,2.03,2.211%,5439697977.00,,,559508,Technology,EDP Services
SAIL,SailPoint Technologies Holdings Inc. Common Stock,$42.73,-0.20,-0.466%,3929481138.00,United States,2017,1061851,Technology,Computer Software: Prepackaged Software
SAK,Saratoga Investment Corp 7.25% Notes due 2025,$26.218,0.018,0.069%,0.00,United States,2020,2419,Finance,Finance Companies
SAM,Boston Beer Company Inc. (The) Common Stock,$1106.29,7.29,0.663%,13592736315.00,United States,,251296,Consumer Non-Durables,Beverages (Production/Distribution)
SAN,Banco Santander S.A. Sponsored ADR (Spain),$4.23,-0.05,-1.168%,73231988026.00,Spain,,1852489,Finance,Commercial Banks
SAND          ,Sandstorm Gold Ltd. Ordinary Shares (Canada),$8.59,0.19,2.262%,1671355871.00,Canada,,839423,Basic Industries,Precious Metals
SAP,SAP  SE ADS,$139.88,2.04,1.48%,164999558079.00,Germany,,234361,Technology,Computer Software: Prepackaged Software
SAR,Saratoga Investment Corp New,$26.39,0.12,0.457%,294512268.00,United States,,18644,,
SAVE,Spirit Airlines Inc. Common Stock,$35.33,-0.41,-1.147%,3829789771.00,United States,,2044430,Transportation,Air Freight/Delivery Services
SB,Safe Bulkers Inc Common Stock ($0.001 par value),$3.68,0.01,0.272%,400658307.00,Monaco,2008,2355468,Transportation,Marine Transportation
SB^C,Safe Bulkers Inc Cumulative Redeemable Perpetual Preferred Series C (Marshall Islands),$25.20,0.01,0.04%,,Monaco,,5176,,
SB^D,Safe Bulkers Inc Perpetual Preferred Series D (Marshall Islands),$25.20,-0.015,-0.059%,,Monaco,,3287,,
SBBA,Scorpio Tankers Inc. 7.00% Senior Notes due 2025,$25.35,0.03,0.118%,0.00,Monaco,2020,4489,Transportation,Marine Transportation
SBG,Sandbridge Acquisition Corporation Class A Common Stock,$9.96,0.00,0.00%,286350000.00,,2020,24294,,
SBH,Sally Beauty Holdings Inc. (Name to be changed from Sally Holdings Inc.) Common Stock,$20.04,-1.33,-6.224%,2263597539.00,United States,,1462596,Miscellaneous,Diversified Commercial Services
SBI,Western Asset Intermediate Muni Fund Inc Common Stock,$9.59,-0.01,-0.104%,135049401.00,United States,1992,22618,,
SBII,Sandbridge X2 Corp. Class A Common Stock,$9.78,0.01,0.102%,291171490.00,,2021,701,,
SBOW,SilverBow Resorces Inc. Common Stock,$19.04,-0.76,-3.838%,232221322.00,,,190905,Energy,Oil & Gas Production
SBR,Sabine Royalty Trust Common Stock,$37.76,0.29,0.774%,550516067.00,United States,,22754,Energy,Oil & Gas Production
SBS,Companhia de saneamento Basico Do Estado De Sao Paulo - Sabesp American Depositary Shares (Each repstg 250 Common Shares),$7.75,0.08,1.043%,5297201485.00,Brazil,2002,1071010,,
SBSW,D/B/A Sibanye-Stillwater Limited ADS,$19.72,0.64,3.354%,14556245135.00,,,2087860,Basic Industries,Precious Metals
SC,Santander Consumer USA Holdings Inc. Common Stock,$38.50,0.36,0.944%,11782375798.00,,2014,455315,Finance,Finance Companies
SCCO,Southern Copper Corporation Common Stock,$71.15,1.75,2.522%,55004163089.00,United States,,1560125,Basic Industries,Precious Metals
SCD,LMP Capital and Income Fund Inc. Common Stock,$14.38,0.19,1.339%,258286413.00,United States,2004,65082,,
SCE^G,SCE Trust II Trust Preferred Securities,$25.04,-0.0097,-0.039%,,United States,,35869,,
SCE^H,SCE Trust III Fixed/Floating Rate Trust Preference Securities,$25.31,-0.08,-0.315%,,United States,,51368,,
SCE^J,Southern California Edison Company 5.375% Fixed-to-Floating Rate Trust Preference Securities,$25.30,0.056,0.222%,,United States,,32705,,
SCE^K,Southern California Edison Company 5.45% Fixed-to-Floating Rate Trust Preference Securities,$25.48,0.00,0.00%,,United States,,75082,,
SCE^L,SCE TRUST VI,$24.90,-0.0396,-0.159%,,United States,,72287,,
SCHW,Charles Schwab Corporation (The) Common Stock,$75.72,-0.29,-0.382%,142834144410.00,United States,,5586720,Finance,Investment Bankers/Brokers/Service
SCHW^D,The Charles Schwab Corporation Depositary Shares each representing 1/40th interest in a share of 5.95% Non-Cumulative Perpetual Preferred Stock Series D,$25.3393,0.0093,0.037%,,United States,,31953,,
